{
  "agfFormatVersion": 1,
  "id": "hard-block",
  "description": "Indestructible wall. Blocks both movement and blast propagation. S135-hotfix: also a static physics body so ragdolls don't fly through the arena perimeter.",
  "components": {
    "Transform": {
      "rotation": [0, 0, 0],
      "scale": [1, 1, 1]
    },
    "MeshRenderer": {
      "mesh": "box",
      "color": "#41525f"
    },
    "GridOccupant": {
      "layer": "wall",
      "blocksMovement": true,
      "blocksBlast": true
    },
    "RigidBody3D": { "type": "fixed" },
    "Collider3D": { "kind": "box", "size": [1, 1, 1] }
  }
}
